{
  "_meta": {
    "auto_generated": true,
    "generated_by": "python3/src/stock_ticker/hugo_generators.py :: generate_filtered_data()",
    "generated_at": "2026-10-28T16:42:19.125409",
    "warning": "DO NOT EDIT - This file is automatically generated and will be overwritten"
  },
  "generated_at": "2026-10-28T16:42:19.125436",
  "date": "2026-10-28",
  "pass1_extraction": {
    "total_attempted": 6219,
    "successful": 2732,
    "failed": 3487,
    "success_rate": "43.9%"
  },
  "pass2_extraction": {
    "total_attempted": 2732,
    "successful": 1103,
    "pending": 1629
  }
}